{
  "version": 1,
  "surface": "mcplane-pulse-default",
  "source": "GUIDERS-ADR-0020 pulse default tier",
  "vectors": [
    {
      "id": "short-pulse-unchanged",
      "outcome": {
        "raw": "Opened buffer README.md",
        "verb": "observe",
        "ok": true,
        "pulse": "Opened buffer README.md"
      },
      "expect": {
        "tier": "Pulse",
        "pulseMaxChars": 240,
        "pulseEndsWithEllipsis": false,
        "outcomeIncluded": false
      }
    },
    {
      "id": "long-pulse-truncated",
      "outcome": {
        "raw": "Lorem ipsum dolor sit amet, consectetur adipiscing elit. Sed do eiusmod tempor incididunt ut labore et dolore magna aliqua. Ut enim ad minim veniam, quis nostrud exercitation ullamco laboris nisi ut aliquip ex ea commodo consequat. Duis aute irure dolor in reprehenderit.",
        "verb": "observe",
        "ok": true,
        "pulse": "Lorem ipsum dolor sit amet, consectetur adipiscing elit. Sed do eiusmod tempor incididunt ut labore et dolore magna aliqua. Ut enim ad minim veniam, quis nostrud exercitation ullamco laboris nisi ut aliquip ex ea commodo consequat. Duis aute irure dolor in reprehenderit."
      },
      "expect": {
        "tier": "Pulse",
        "pulseMaxChars": 240,
        "pulseEndsWithEllipsis": true,
        "outcomeIncluded": false
      }
    }
  ]
}
